{
  "blocks": [
    {
      "delta": null,
      "displayValue": "Maritime Administrator Tours Bluecore Energy Research Headquarters at the Port of Long Beach",
      "key": "latest_headline",
      "label": "Latest Headline",
      "presenter": "markdown",
      "provenance": {
        "anchor": "https://www.bluecore.energy/news-insights#html > body > div:nth-of-type(4) > div > div:nth-of-type(2) > div > div:nth-of-type(1) > a > div:nth-of-type(3) > div:nth-of-type(2)",
        "contentHash": "sha256:2bb00c8ddb95e10ee5e09632a01b459f1a885f3627e7748fea27d76ac623fa48",
        "extractedAt": "2026-09-12T21:30:26.070Z",
        "rawText": "Maritime Administrator Tours Bluecore Energy Research Headquarters at the Port of Long Beach",
        "sourceUrl": "https://www.bluecore.energy/news-insights"
      },
      "status": "ok",
      "type": "string",
      "validation": {
        "passed": true,
        "warnings": []
      },
      "value": "Maritime Administrator Tours Bluecore Energy Research Headquarters at the Port of Long Beach"
    },
    {
      "delta": null,
      "displayValue": "8 Sep 2026",
      "key": "latest_post_date",
      "label": "Latest Post Date",
      "presenter": "metric",
      "provenance": {
        "anchor": "https://www.bluecore.energy/news-insights#html > body > div:nth-of-type(4) > div > div:nth-of-type(2) > div > div:nth-of-type(1) > a > div:nth-of-type(3) > div:nth-of-type(1)",
        "contentHash": "sha256:e0cc0dad1281581478b2c7298b610fa1c0d0de8f3ab1ad078d85d43cc8427a86",
        "extractedAt": "2026-09-12T21:30:26.074Z",
        "rawText": "September 8, 2026",
        "sourceUrl": "https://www.bluecore.energy/news-insights"
      },
      "status": "ok",
      "type": "date",
      "validation": {
        "passed": true,
        "warnings": []
      },
      "value": "2026-09-08T00:00:00.000Z"
    },
    {
      "delta": null,
      "displayValue": "Press Release",
      "key": "latest_post_category",
      "label": "Latest Post Category",
      "presenter": "status",
      "provenance": {
        "anchor": "https://www.bluecore.energy/news-insights#html > body > div:nth-of-type(4) > div > div:nth-of-type(2) > div > div:nth-of-type(1) > a > div:nth-of-type(1)",
        "contentHash": "sha256:180c9abd7392671b20a7438ab3b9fe55dfbe981f3f783de7757dd0b203894e2c",
        "extractedAt": "2026-09-12T21:30:26.076Z",
        "rawText": "Press Release",
        "sourceUrl": "https://www.bluecore.energy/news-insights"
      },
      "status": "ok",
      "type": "enum",
      "validation": {
        "passed": true,
        "warnings": []
      },
      "value": "Press Release"
    }
  ],
  "entityId": "bluecore-energy",
  "label": "BlueCore Energy — Latest News",
  "run": {
    "completedAt": "2026-09-12T21:30:25.922Z",
    "durationMs": 0,
    "httpStatus": 200,
    "renderer": "static",
    "runId": "2026-09-12T21-30-25-906Z-f2b8ec4",
    "startedAt": "2026-09-12T21:30:25.922Z",
    "status": "ok"
  },
  "schemaVersion": 1,
  "sectionId": "target",
  "sourceUrl": "https://www.bluecore.energy/news-insights",
  "targetId": "bluecore-newsroom",
  "ttlHours": 168
}
